{
  "evaluation_metadata": {
    "candidate_id": "C-006",
    "repo_url": "https://github.com/moroshek/roadmap-Ajayd7",
    "evaluated_at": "2026-02-16T12:00:00Z",
    "evaluator": "gemini-cli",
    "framework_version": "1.0"
  },
  "automated_gate": {
    "G1_package_json_exists": { "pass": true, "notes": "Found in root." },
    "G2_install_succeeds": { "pass": true, "notes": "Node modules present and build succeeded." },
    "G3_build_succeeds": { "pass": true, "notes": "Successfully ran npm run build." },
    "G4_matrix_route_exists": { "pass": true, "notes": "src/app/matrix/page.tsx exists." },
    "G5_project_files_exist": { "pass": true, "count": 5, "notes": "Found 5 project files." },
    "G6_chart_library_installed": { "pass": true, "library": "recharts", "notes": "" },
    "G7_normalization_logic_exists": { "pass": true, "notes": "Implemented in src/lib/projects.ts" },
    "G8_quadrant_logic_exists": { "pass": true, "notes": "Implemented in src/lib/projects.ts" },
    "G9_chart_renders_data": { "pass": true, "notes": "Verified StrategyMatrix.tsx renders filteredData." },
    "G10_tooltips_implemented": { "pass": true, "notes": "MatrixTooltip.tsx implemented with rich data." },
    "gate_summary": {
      "total_passed": 10,
      "total_failed": 0,
      "automatic_failure_triggered": false,
      "failure_reasons": []
    }
  },
  "rubric_scores": {
    "A_strategy_matrix": {
      "weight": 0.30,
      "criteria": {
        "A1_data_population": { "score": 4, "evidence": "_content/projects/ contains 5 projects with realistic data.", "notes": "Exceeded requirement by adding a 5th project." },
        "A2_score_normalization": { "score": 4, "evidence": "src/lib/projects.ts:56-57", "notes": "Normalization is handled in the data transformation layer." },
        "A3_quadrant_assignment": { "score": 4, "evidence": "src/lib/projects.ts:64-77", "notes": "Clean logic in data layer, handles boundaries correctly." },
        "A4_scatter_plot_rendering": { "score": 4, "evidence": "src/components/StrategyMatrix.tsx", "notes": "Premium chart with ReferenceArea zones and styled axes." },
        "A5_tooltip_implementation": { "score": 4, "evidence": "src/components/matrix/MatrixTooltip.tsx", "notes": "Rich tooltip showing ID, scores, lead, and calculated ROI." },
        "A6_logic_ui_separation": { "score": 4, "evidence": "Logic in src/lib/projects.ts, UI in src/components/StrategyMatrix.tsx", "notes": "Exemplary separation of concerns." }
      },
      "category_score": 100.0,
      "category_commentary": "Flawless implementation of the core requirement with a clean data pipeline and polished UI."
    },
    "B_technical_foundation": {
      "weight": 0.15,
      "criteria": {
        "B1_project_setup": { "score": 4, "evidence": "package.json, tsconfig.json", "notes": "Professional Next.js setup with TypeScript and Tailwind." },
        "B2_routing_navigation": { "score": 4, "evidence": "src/app/ layout and folders", "notes": "Full navigation system matching PRD (Dashboard, Matrix, Projects, Roadmap)." },
        "B3_type_safety": { "score": 4, "evidence": "src/lib/projects.ts", "notes": "Excellent use of Zod for validation and type inference." },
        "B4_data_layer": { "score": 4, "evidence": "src/lib/projects.ts", "notes": "Centralized content loader with schema validation." }
      },
      "category_score": 100.0,
      "category_commentary": "Strong technical foundation using modern best practices and robust type safety."
    },
    "C_ui_ux_quality": {
      "weight": 0.15,
      "criteria": {
        "C1_visual_design": { "score": 4, "evidence": "StrategyMatrix.tsx, page.tsx", "notes": "Premium visual design, feels like a real SaaS product." },
        "C2_responsive_design": { "score": 4, "evidence": "Tailwind responsive classes throughout", "notes": "Responsive layout with collapsing sidebar." },
        "C3_interactivity": { "score": 4, "evidence": "StrategyMatrix filters, Tooltip hover", "notes": "Smooth interactions and multi-faceted filtering." },
        "C4_empty_error_loading_states": { "score": 2, "evidence": "globals.css .skeleton defined but not used", "notes": "Basic handling; no crash but skeleton loaders are missing." },
        "C5_design_token_usage": { "score": 1, "evidence": "src/lib/constants.ts", "notes": "Did not use config.json for dynamic theming; colors are hardcoded." }
      },
      "category_score": 75.0,
      "category_commentary": "Excellent visual design and interactivity, though dynamic theming and loading states were missed."
    },
    "D_prd_compliance": {
      "weight": 0.10,
      "criteria": {
        "D1_schema_adherence": { "score": 4, "evidence": "src/lib/projects.ts ProjectSchema", "notes": "Zod schema matches PRD exactly." },
        "D2_quadrant_logic_accuracy": { "score": 4, "evidence": "src/lib/projects.ts:64-77", "notes": "Exact match to PRD boundaries and labels." },
        "D3_route_structure": { "score": 4, "evidence": "src/app/", "notes": "All PRD routes implemented." },
        "D4_specification_details": { "score": 4, "evidence": "GlobalSearch.tsx (Cmd+K, Fuse.js weighting)", "notes": "Attended to specific details like Cmd+K and Fuse.js weighting." }
      },
      "category_score": 100.0,
      "category_commentary": "Strict adherence to the PRD across both core and bonus features."
    },
    "E_code_quality": {
      "weight": 0.20,
      "criteria": {
        "E1_separation_of_concerns": { "score": 4, "evidence": "Folder structure", "notes": "Exemplary separation between data, components, and pages." },
        "E2_readability_naming": { "score": 4, "evidence": "Throughout src/", "notes": "Clean, descriptive naming and self-documenting code." },
        "E3_error_handling": { "score": 4, "evidence": "src/lib/projects.ts", "notes": "Robust validation and error logging for project data." },
        "E4_dependency_choices": { "score": 4, "evidence": "package.json", "notes": "Well-chosen stack: Recharts, Fuse.js, Zod." }
      },
      "category_score": 100.0,
      "category_commentary": "High-quality, maintainable code that follows industry best practices."
    },
    "F_bonus_features": {
      "weight": 0.05,
      "criteria": {
        "F1_dashboard": { "score": 4, "evidence": "src/app/page.tsx", "notes": "Full dashboard with real calculations and widgets." },
        "F2_additional_pages": { "score": 4, "evidence": "src/app/roadmap, src/app/projects", "notes": "All primary routes implemented." },
        "F3_search_filtering": { "score": 4, "evidence": "GlobalSearch.tsx, StrategyMatrix.tsx", "notes": "Fuzzy search and multi-faceted filtering implemented." },
        "F4_creative_additions": { "score": 4, "evidence": "src/components/GanttChart.tsx", "notes": "Gantt chart is an impressive addition beyond the PRD." }
      },
      "category_score": 100.0,
      "category_commentary": "Exceptional bonus work, particularly the Gantt chart and global search."
    },
    "G_decision_making": {
      "weight": 0.05,
      "criteria": {
        "G1_prioritization": { "score": 4, "evidence": "Overall submission content", "notes": "Focused on high-impact features (Matrix, Dashboard, Gantt)." },
        "G2_pr_description": { "score": 0, "evidence": "README.md", "notes": "README is boilerplate; no custom implementation notes provided." }
      },
      "category_score": 50.0,
      "category_commentary": "Technical prioritization was excellent, but communication via documentation was missing."
    }
  },
  "git_history_bonus": {
    "H1_commit_cadence": { "points": 2, "evidence": "7 commits", "notes": "Logical progression from scaffold to polish." },
    "H2_message_quality": { "points": 1, "evidence": "Commit log", "notes": "Descriptive but some typos." },
    "H3_logical_progression": { "points": 1, "evidence": "Commit log", "notes": "Clear build-up of features." },
    "bonus_total": 4
  },
  "scoring_summary": {
    "category_scores": {
      "A_strategy_matrix": 100.0,
      "B_technical_foundation": 100.0,
      "C_ui_ux_quality": 75.0,
      "D_prd_compliance": 100.0,
      "E_code_quality": 100.0,
      "F_bonus_features": 100.0,
      "G_decision_making": 50.0
    },
    "weighted_score": 93.75,
    "git_bonus": 4,
    "final_score": 97.75,
    "score_band": "Exceptional",
    "automatic_failure": false,
    "automatic_failure_reasons": []
  },
  "qualitative_summary": {
    "top_strengths": [
      "Exceptional technical foundation using Zod for robust data validation and type safety.",
      "Impressive velocity, delivering a functional Gantt chart and fuzzy search within the timebox.",
      "High-quality UI/UX with premium-feeling chart interactions and dashboard widgets."
    ],
    "top_weaknesses": [
      "Missed dynamic theming from config.json, despite clear PRD instructions.",
      "Lack of documentation/summary in the README or a dedicated implementation file.",
      "Skeleton loaders were defined in CSS but not implemented in the UI."
    ],
    "standout_moments": [
      "The inclusion of a Gantt chart was a significant value-add that demonstrated deep technical capability.",
      "The global search implementation with Cmd+K and Fuse.js weighting was a very nice detail."
    ],
    "hiring_signal": "Ajayd7 is a top-tier full-stack developer who can ship polished, complex features with high velocity and technical rigor. They demonstrate excellent architectural thinking and attention to spec details. While they missed some configuration-driven theming requirements, their ability to deliver a nearly complete product-grade experience in a short window is remarkable.",
    "recommendation": "Strong Hire"
  }
}
